{"job_id":"f2ff5a17-3ba0-4418-9038-fa147ac78b5c","status":"error","summary":{"period":"2099-01","dataset_ref":"dataset_consumo_energetico.csv"},"metrics":[{"name":"records_count","value":0,"unit":"count","source":"deterministic"}],"findings":[],"recommendations_draft":[],"warnings":[{"code":"NO_DATA_FOR_FILTER","message":"Filtros aplicados no arrojaron registros. Revise period/facility_filter."}],"trace":{"prompt_version":"v1.0","documents_used":["dataset_consumo_energetico.csv","contexto_criterios_hallazgos.md","contexto_recomendaciones.md","contexto_salida_estructurada.md"],"rules_applied":["kwh_per_unit = energy_kwh / production_units","variance_vs_target_pct = ((kwh_per_unit - target) / target) * 100","estimated_emissions_kg = energy_kwh * co2_factor_kg_per_kwh","severidad: baja 0-5%, media 5-12%, alta >12%","LLM solo redacta, no calcula"]}}